{
  "topic": "Tierärztin Dr. Mertens",
  "aliases": [],
  "media": {
    "tvdbId": 129981,
    "imdbId": "tt5765570",
    "name": "Tierärztin Dr. Mertens",
    "type": "show"
  },
  "confidence": 0.9,
  "rules": [
    {
      "id": "season-episode",
      "priority": 10,
      "strategy": "seasonAndEpisodeNumber",
      "filters": {
        "all": [
          {
            "field": "duration",
            "op": "greaterThan",
            "value": "35"
          }
        ]
      },
      "seasonRegex": "(?<=\\(S)(\\d{2})(?=/E\\d{2}\\))",
      "episodeRegex": "(?<=\\(S\\d{2}/E)(\\d{2})(?=\\))"
    },
    {
      "id": "title-exact",
      "priority": 20,
      "strategy": "itemTitleExact",
      "filters": {
        "all": [
          {
            "field": "duration",
            "op": "greaterThan",
            "value": "35"
          }
        ]
      },
      "titleRules": [
        {
          "type": "regex",
          "field": "title",
          "pattern": "^Folge \\d+: (.+?)(?:\\s*\\(S\\d{2}/E\\d{2}\\))?$"
        }
      ]
    }
  ]
}