{
  "topic": "Frühling",
  "aliases": [
    "Film"
  ],
  "media": {
    "tvdbId": 289363,
    "imdbId": "tt7887026",
    "name": "Frühling",
    "type": "show"
  },
  "confidence": 0.9,
  "rules": [
    {
      "id": "season-episode",
      "priority": 5,
      "strategy": "seasonAndEpisodeNumber",
      "filters": {
        "all": [
          {
            "field": "duration",
            "op": "greaterThan",
            "value": "50"
          }
        ]
      },
      "seasonRegex": "(?<=\\(S)(\\d{2,4})(?=/E)",
      "episodeRegex": "(?<=/E)(\\d{2,4})(?=\\))"
    },
    {
      "id": "title-exact",
      "priority": 20,
      "strategy": "itemTitleExact",
      "filters": {
        "all": [
          {
            "field": "duration",
            "op": "greaterThan",
            "value": "50"
          }
        ]
      },
      "titleRules": [
        {
          "type": "regex",
          "field": "title",
          "pattern": "(.*)"
        }
      ]
    },
    {
      "id": "title-from-film",
      "priority": 40,
      "strategy": "itemTitleExact",
      "filters": {
        "all": [
          {
            "field": "title",
            "op": "contains",
            "value": "Frühling"
          },
          {
            "field": "duration",
            "op": "greaterThan",
            "value": "50"
          }
        ]
      },
      "titleRules": [
        {
          "type": "regex",
          "field": "title",
          "pattern": "Frühling - (.*)"
        }
      ]
    }
  ]
}