{
  "topic": "Spielfilm",
  "aliases": [
    "Schachnovelle"
  ],
  "media": {
    "imdbId": "tt9781494",
    "tmdbId": 718638,
    "name": "Schachnovelle",
    "type": "movie"
  },
  "confidence": 0.8,
  "rules": [
    {
      "id": "title-match",
      "priority": 0,
      "filters": {
        "all": [
          {
            "field": "topic",
            "op": "contains",
            "value": "Spielfilm"
          }
        ]
      },
      "strategy": "itemTitleIncludes",
      "titleRules": [
        {
          "type": "static",
          "value": "Schachnovelle"
        }
      ]
    }
  ]
}
