{
  "topic": "Spielfilm",
  "aliases": [
    "Kick It Like Beckham"
  ],
  "media": {
    "imdbId": "tt0286499",
    "tmdbId": 455,
    "name": "Bend It Like Beckham",
    "type": "movie"
  },
  "confidence": 0.8,
  "rules": [
    {
      "id": "title-match",
      "priority": 0,
      "filters": {
        "all": [
          {
            "field": "topic",
            "op": "contains",
            "value": "Spielfilm"
          }
        ]
      },
      "strategy": "itemTitleIncludes",
      "titleRules": [
        {
          "type": "static",
          "value": "Kick It Like Beckham"
        }
      ]
    }
  ]
}
