{
  "topic": "Lass dich überwachen!",
  "aliases": [],
  "media": {
    "tvdbId": 345251,
    "name": "Lass dich überwachen!",
    "type": "show"
  },
  "confidence": 0.85,
  "rules": [
    {
      "id": "season-episode",
      "priority": 0,
      "strategy": "seasonAndEpisodeNumber",
      "filters": {
        "all": [
          {
            "field": "duration",
            "op": "greaterThan",
            "value": "55"
          }
        ]
      },
      "seasonRegex": "(?<=\\(S)(\\d{2,4})(?=/E)",
      "episodeRegex": "(?<=/E)(\\d{2,4})(?=\\))"
    },
    {
      "id": "airdate",
      "priority": 10,
      "strategy": "itemTitleEqualsAirdate",
      "filters": {
        "all": [
          {
            "field": "duration",
            "op": "greaterThan",
            "value": "55"
          }
        ]
      }
    }
  ]
}