{
  "topic": "Unsere Kontinente",
  "aliases": [
    "Terra X: Unsere Kontinente",
    "The Six Continents Revealed"
  ],
  "media": {
    "tvdbId": 424664,
    "name": "The Six Continents Revealed",
    "type": "show"
  },
  "confidence": 0.9,
  "rules": [
    {
      "id": "season-episode",
      "priority": 0,
      "filters": {
        "all": [
          {
            "field": "duration",
            "op": "greaterThan",
            "value": "35"
          }
        ]
      },
      "strategy": "seasonAndEpisodeNumber",
      "seasonRegex": "(?<=S)(\\d{2,4})(?=\\s*/E\\d{2,4})",
      "episodeRegex": "(?<=\\bS\\d{2,4}\\s*/E)(\\d{2,4})(?=\\))",
      "titleRules": []
    },
    {
      "id": "title-includes",
      "priority": 1,
      "filters": {
        "all": [
          {
            "field": "duration",
            "op": "greaterThan",
            "value": "35"
          }
        ]
      },
      "strategy": "itemTitleIncludes",
      "titleRules": [
        {
          "type": "regex",
          "field": "title",
          "pattern": "^(.*?)(?:\\s*\\([^)]*\\))?$"
        }
      ]
    }
  ]
}
