{
  "topic": "Terra X - Wettlauf um die Welt",
  "aliases": [],
  "media": {
    "tvdbId": 462866,
    "name": "Terra X - Wettlauf um die Welt",
    "type": "show"
  },
  "confidence": 0.9,
  "rules": [
    {
      "id": "season-episode",
      "priority": 0,
      "filters": {
        "all": [
          {
            "field": "duration",
            "op": "greaterThan",
            "value": "35"
          }
        ]
      },
      "strategy": "seasonAndEpisodeNumber",
      "seasonRegex": "(?<=S)(\\d{2,4})(?=\\s*/E\\d{2,4})",
      "episodeRegex": "(?<=\\bS\\d{2,4}\\s*/E)(\\d{2,4})(?=\\))",
      "titleRules": []
    },
    {
      "id": "title-exact",
      "priority": 1,
      "filters": {
        "all": [
          {
            "field": "duration",
            "op": "greaterThan",
            "value": "35"
          }
        ]
      },
      "strategy": "itemTitleExact",
      "titleRules": [
        {
          "type": "regex",
          "field": "title",
          "pattern": "^(.*?)\\s*-\\s*Terra X\\s*-\\s*Wettlauf um die Welt"
        }
      ]
    }
  ]
}
