{
  "topic": "Das Traumschiff",
  "aliases": [],
  "media": {
    "tvdbId": 133371,
    "imdbId": "tt0207932",
    "name": "Das Traumschiff",
    "type": "show"
  },
  "confidence": 0.85,
  "rules": [
    {
      "id": "season-episode",
      "priority": 0,
      "strategy": "seasonAndEpisodeNumber",
      "filters": {
        "all": [
          {
            "field": "duration",
            "op": "greaterThan",
            "value": "70"
          }
        ]
      },
      "seasonRegex": "(?<=\\(S)(\\d{2,4})(?=/E)",
      "episodeRegex": "(?<=/E)(\\d{2,4})(?=\\))"
    },
    {
      "id": "title-exact",
      "priority": 1,
      "strategy": "itemTitleExact",
      "filters": {
        "all": [
          {
            "field": "duration",
            "op": "greaterThan",
            "value": "70"
          }
        ]
      },
      "titleRules": [
        {
          "type": "regex",
          "field": "title",
          "pattern": "^(.*?)(?:\\s*\\([^)]*\\))?$"
        }
      ]
    },
    {
      "id": "title-exact-p1",
      "priority": 2,
      "strategy": "itemTitleExact",
      "filters": {
        "all": [
          {
            "field": "duration",
            "op": "greaterThan",
            "value": "70"
          }
        ]
      },
      "titleRules": [
        {
          "type": "regex",
          "field": "title",
          "pattern": "(?<=Das Traumschiff:\\s*)\\S.*"
        }
      ]
    },
    {
      "id": "title-exact-p10",
      "priority": 3,
      "strategy": "itemTitleExact",
      "filters": {
        "all": [
          {
            "field": "duration",
            "op": "greaterThan",
            "value": "70"
          }
        ]
      },
      "titleRules": [
        {
          "type": "regex",
          "field": "title",
          "pattern": "^(.*?)(?= - Retro-Folge von \\d{4}(?: \\(|$))"
        }
      ]
    },
    {
      "id": "title-includes",
      "priority": 4,
      "strategy": "itemTitleIncludes",
      "filters": {
        "all": [
          {
            "field": "duration",
            "op": "greaterThan",
            "value": "70"
          }
        ]
      },
      "titleRules": [
        {
          "type": "regex",
          "field": "title",
          "pattern": "^(.*?)(?= - Retro-Folge von \\d{4}(?: \\(|$))"
        }
      ]
    }
  ]
}