{
  "topic": "Spielfilm",
  "aliases": [
    "Match Point"
  ],
  "media": {
    "imdbId": "tt0416320",
    "tmdbId": 116,
    "name": "Match Point",
    "type": "movie"
  },
  "confidence": 0.8,
  "rules": [
    {
      "id": "title-match",
      "priority": 0,
      "filters": {
        "all": [
          {
            "field": "topic",
            "op": "contains",
            "value": "Spielfilm"
          }
        ]
      },
      "strategy": "itemTitleIncludes",
      "titleRules": [
        {
          "type": "static",
          "value": "Match Point"
        }
      ]
    }
  ]
}
