{
  "topic": "30 Tage Lust",
  "aliases": [],
  "media": {
    "tvdbId": 447160,
    "imdbId": "tt31921149",
    "name": "30 Tage Lust",
    "type": "show"
  },
  "confidence": 0.95,
  "rules": [
    {
      "id": "season-episode",
      "priority": 0,
      "filters": {
        "all": [
          {
            "field": "duration",
            "op": "greaterThan",
            "value": "20"
          }
        ]
      },
      "strategy": "seasonAndEpisodeNumber",
      "seasonRegex": "(?<=S)(\\d{2,4})(?=\\s*/E\\d{2,4})",
      "episodeRegex": "(?<=\\bS\\d{2,4}\\s*/E)(\\d{2,4})(?=\\))",
      "titleRules": []
    }
  ]
}
