{
  "topic": "Die Sendung mit der Maus",
  "aliases": [],
  "media": {
    "tvdbId": 153241,
    "imdbId": "tt0065345",
    "name": "Die Sendung mit der Maus",
    "type": "show"
  },
  "confidence": 0.85,
  "rules": [
    {
      "id": "airdate",
      "priority": 0,
      "strategy": "itemTitleEqualsAirdate",
      "filters": {
        "all": [
          {
            "field": "duration",
            "op": "greaterThan",
            "value": "21"
          }
        ]
      }
    },
    {
      "id": "title-exact",
      "priority": 10,
      "strategy": "itemTitleExact",
      "filters": {
        "all": [
          {
            "field": "duration",
            "op": "greaterThan",
            "value": "21"
          }
        ]
      },
      "titleRules": [
        {
          "type": "regex",
          "field": "title",
          "pattern": "^(.*?)(?:\\s*\\([^)]*\\))?$"
        }
      ]
    }
  ]
}