{
  "topic": "Sturm der Liebe",
  "aliases": [],
  "media": {
    "tvdbId": 176491,
    "imdbId": "tt0479846",
    "name": "Sturm der Liebe",
    "type": "show"
  },
  "confidence": 0.9,
  "rules": [
    {
      "id": "absolute-episode",
      "priority": 0,
      "strategy": "byAbsoluteEpisodeNumber",
      "filters": {
        "all": [
          {
            "field": "duration",
            "op": "greaterThan",
            "value": "35"
          }
        ]
      },
      "episodeRegex": "Episode\\s(\\d+)"
    },
    {
      "id": "absolute-episode-p1",
      "priority": 1,
      "strategy": "byAbsoluteEpisodeNumber",
      "filters": {
        "all": [
          {
            "field": "duration",
            "op": "greaterThan",
            "value": "35"
          }
        ]
      },
      "episodeRegex": "\\((\\d+)\\)"
    },
    {
      "id": "absolute-episode-folge",
      "priority": 2,
      "strategy": "byAbsoluteEpisodeNumber",
      "filters": {
        "all": [
          {
            "field": "duration",
            "op": "greaterThan",
            "value": "35"
          }
        ]
      },
      "episodeRegex": "(?:^|\\b)Folge\\s+(\\d+)"
    },
    {
      "id": "absolute-episode-teil",
      "priority": 3,
      "strategy": "byAbsoluteEpisodeNumber",
      "filters": {
        "all": [
          {
            "field": "duration",
            "op": "greaterThan",
            "value": "35"
          }
        ]
      },
      "episodeRegex": "Teil\\s+(\\d+)"
    }
  ]
}