{
  "topic": "Mitternachtsspitzen",
  "aliases": [],
  "media": {
    "tvdbId": 355035,
    "imdbId": "tt0473587",
    "name": "Mitternachtsspitzen",
    "type": "show"
  },
  "confidence": 0.85,
  "rules": [
    {
      "id": "title-exact",
      "priority": 0,
      "filters": {
        "all": [
          {
            "field": "duration",
            "op": "greaterThan",
            "value": "43"
          }
        ]
      },
      "strategy": "itemTitleExact",
      "titleRules": [
        {
          "type": "regex",
          "field": "title",
          "pattern": "(.*)"
        }
      ]
    },
    {
      "id": "title-includes",
      "priority": 20,
      "filters": {
        "all": [
          {
            "field": "duration",
            "op": "greaterThan",
            "value": "43"
          }
        ]
      },
      "strategy": "itemTitleIncludes",
      "titleRules": [
        {
          "type": "regex",
          "field": "title",
          "pattern": "(.*)"
        },
        {
          "type": "static",
          "field": "title",
          "value": " 20"
        }
      ]
    }
  ]
}
