{
  "topic": "ZDF Magazin Royale",
  "aliases": [
    "ZDF Magazin Royale - Late-Night mit Jan Böhmermann"
  ],
  "media": {
    "tvdbId": 390284,
    "imdbId": "tt13486352",
    "name": "ZDF Magazin Royale",
    "type": "show"
  },
  "confidence": 0.9,
  "rules": [
    {
      "id": "season-episode",
      "priority": 0,
      "filters": {
        "all": [
          {
            "field": "duration",
            "op": "greaterThan",
            "value": "24"
          }
        ]
      },
      "strategy": "seasonAndEpisodeNumber",
      "seasonRegex": "(?<=S)(\\d{2,4})(?=\\s*/E\\d{2,4})",
      "episodeRegex": "(?<=\\bS\\d{2,4}\\s*/E)(\\d{2,4})(?=\\))",
      "titleRules": []
    },
    {
      "id": "title-exact",
      "priority": 1,
      "filters": {
        "all": [
          {
            "field": "duration",
            "op": "greaterThan",
            "value": "24"
          }
        ]
      },
      "strategy": "itemTitleExact",
      "titleRules": [
        {
          "type": "regex",
          "field": "title",
          "pattern": "^(.+?)\\s*-\\s*ZDF Magazin Royale"
        }
      ]
    },
    {
      "id": "title-exact-p2",
      "priority": 2,
      "filters": {
        "all": [
          {
            "field": "duration",
            "op": "greaterThan",
            "value": "24"
          }
        ]
      },
      "strategy": "itemTitleExact",
      "titleRules": [
        {
          "type": "regex",
          "field": "title",
          "pattern": "^(.*?)(?:\\s*\\([^)]*\\))?$"
        }
      ]
    }
  ]
}
